{
  "schemaVersion": 1,
  "slug": "danang-hoian-family-2027",
  "title": "다낭·호이안 가족여행",
  "subtitle": "엄마·아빠·초등학생 아이가 함께 떠나는 3박 5일 자유여행",
  "startDate": "2027-03-03",
  "endDate": "2027-03-07",
  "timezone": "Asia/Ho_Chi_Minh",
  "visibility": "public",
  "isSample": true,
  "coverPhoto": {
    "src": "https://upload.wikimedia.org/wikipedia/commons/thumb/7/73/Lanterns_in_Hoi_An_%2840542858941%29.jpg/1920px-Lanterns_in_Hoi_An_%2840542858941%29.jpg",
    "alt": "호이안 올드타운 거리에 걸린 형형색색의 등불",
    "credit": "Mig Gilbert from Brighton · Wikimedia Commons",
    "license": "CC BY-SA 2.0",
    "sourceUrl": "https://commons.wikimedia.org/wiki/File:Lanterns_in_Hoi_An_(40542858941).jpg"
  },
  "travelers": [
    {
      "label": "엄마",
      "emoji": "👩"
    },
    {
      "label": "아빠",
      "emoji": "👨"
    },
    {
      "label": "아이",
      "emoji": "🧒"
    }
  ],
  "flights": [
    {
      "direction": "outbound",
      "airline": "트리니티항공(구 티웨이항공) TW011",
      "from": "ICN",
      "to": "DAD",
      "date": "2027-03-03",
      "depart": "19:00",
      "arrive": "22:20",
      "note": "예시 일정이에요. 2026년 11월 하나투어·모두투어 상품에 실린 TW011 시각(인천 19:00 → 다낭 22:20, 현지 시각)을 옮겼어요. 2027년 3월 운항 시각은 항공사 예약 화면에서 다시 확인하세요."
    },
    {
      "direction": "return",
      "airline": "트리니티항공(구 티웨이항공) TW012",
      "from": "DAD",
      "to": "ICN",
      "date": "2027-03-06",
      "depart": "23:35",
      "arrive": "06:05",
      "arrivesNextDay": true,
      "note": "예시 일정이에요. 다낭 23:35(현지 시각) 출발, 인천 06:05(한국 시각) 도착으로 2026년 11월 상품의 TW012 시각을 옮겼어요. 실제 예약의 편명과 시각을 확인하세요."
    }
  ],
  "route": [
    {
      "code": "ICN",
      "label": "인천",
      "vehicle": "flight",
      "vehicleLabel": "TW011 · 약 5시간 20분"
    },
    {
      "code": "DAD",
      "label": "다낭",
      "vehicle": "car",
      "vehicleLabel": "기사 포함 차량 · 오행산 경유"
    },
    {
      "code": "HOI",
      "label": "호이안",
      "vehicle": "car",
      "vehicleLabel": "Grab 7인승 · 약 50분"
    },
    {
      "code": "DAD",
      "label": "다낭",
      "vehicle": "flight",
      "vehicleLabel": "TW012 · 약 4시간 30분"
    },
    {
      "code": "ICN",
      "label": "인천"
    }
  ],
  "days": [
    {
      "number": 1,
      "date": "2027-03-03",
      "city": "INCHEON → DA NANG",
      "theme": "저녁 비행기로 다낭 도착, 미케 비치 숙소로",
      "note": "한국 시각으로 움직이는 오후와 다낭 현지 시각(한국보다 2시간 느림)으로 움직이는 밤이 섞인 날이에요. 표의 출국 전 시각은 한국 시각, 다낭 도착부터는 현지 시각이에요. 저가항공이라 기내식이 유료이니 출국 전에 저녁을 먹어요. 다낭 도착은 22:20 예정이라 입국심사와 짐 찾기가 늦어지면 숙소 도착이 자정을 넘을 수 있어요. 사전 입국신고 QR과 아이의 영문 가족관계증명서를 휴대폰과 종이로 함께 준비하고, 숙소에는 늦은 체크인을 미리 알려요.",
      "stops": [
        {
          "id": "d1-home",
          "time": "15:30",
          "title": "집에서 인천공항으로 출발 (한국 시각)",
          "type": "transport",
          "details": "공항철도나 공항 리무진을 타고 제1여객터미널로 가요. 퇴근 시간대와 겹치면 길이 막힐 수 있어 출발 3시간 30분 전에 집을 나서요.",
          "timing": "가족 계획",
          "duration": "약 1시간–1시간 30분",
          "transportIcon": "🚆"
        },
        {
          "id": "d1-icn",
          "time": "16:00",
          "title": "인천공항 제1여객터미널 도착 (한국 시각)",
          "type": "airport",
          "details": "트리니티항공(구 티웨이항공) 카운터 위치를 출발층 안내판에서 확인해요. 항공사 카운터가 열리기 전이면 화장실과 환전·유심 수령을 먼저 해요.",
          "timing": "가족 계획",
          "duration": "10분",
          "coordinates": [
            37.4496,
            126.4521
          ],
          "links": [
            {
              "label": "인천국제공항 공식 사이트",
              "url": "https://www.airport.kr/ap_ko/index.do"
            }
          ]
        },
        {
          "id": "d1-checkin",
          "time": "16:10",
          "title": "체크인·수하물 위탁",
          "type": "airport",
          "details": "여권 3개와 예약 확인서를 함께 보여 줘요. 보조배터리는 기내 가방에만 넣어요. 베트남은 전자담배 반입과 사용이 금지돼 있으니 짐에 넣지 않아요.",
          "timing": "상품 안내",
          "duration": "약 40분 · 줄에 따라 다름",
          "buffer": "17:00 전 보안검색 시작 목표",
          "links": [
            {
              "label": "트리니티항공(구 티웨이항공) 공식 사이트",
              "url": "https://www.twayair.com/",
              "note": "예시 편명 TW011·TW012 · 실제 예약 시각 확인"
            }
          ]
        },
        {
          "id": "d1-security",
          "time": "17:00",
          "title": "보안검색·출국심사",
          "type": "airport",
          "details": "아이와 함께라면 일반 심사대가 편할 수 있어요. 자동출입국심사 이용 조건은 출입국 안내를 확인해요.",
          "timing": "가족 계획",
          "duration": "약 30분"
        },
        {
          "id": "d1-dinner",
          "time": "17:40",
          "title": "면세구역에서 저녁 식사",
          "type": "meal",
          "details": "기내식이 유료라 탑승 전에 든든히 먹어요. 아이 간식과 물은 보안검색을 통과한 뒤에 사요.",
          "timing": "가족 계획",
          "duration": "약 40분",
          "buffer": "18:20 탑승구 이동"
        },
        {
          "id": "d1-gate",
          "time": "18:20",
          "title": "탑승구 이동·탑승",
          "type": "airport",
          "details": "탑승권의 게이트 번호를 확인해요. 탑승은 보통 출발 30–40분 전에 시작해요. 게이트가 멀면 셔틀 트레인을 타야 할 수 있어요.",
          "timing": "상품 안내",
          "duration": "약 40분"
        },
        {
          "id": "d1-flight",
          "time": "19:00",
          "title": "인천 → 다낭 · TW011",
          "type": "flight",
          "details": "트리니티항공 TW011 예시 편이에요. 약 5시간 20분 비행 후 현지 시각 22:20 다낭 도착 예정이에요. 기내에서 아이 겉옷을 꺼내 두고, 내리기 전에 입국신고 QR 캡처를 다시 확인해요.",
          "timing": "상품 안내 · 실제 예약 확인",
          "duration": "약 5시간 20분",
          "transportIcon": "✈️",
          "coordinates": [
            37.4496,
            126.4521
          ],
          "links": [
            {
              "label": "TW11 운항 시각 참고 · Airpaz",
              "url": "https://www.airpaz.com/en/flight/code/TW-11"
            }
          ]
        },
        {
          "id": "d1-dad",
          "time": "22:20",
          "title": "다낭공항 도착·입국심사 (현지 시각)",
          "type": "airport",
          "details": "여권과 함께 사전 입국신고 QR을 보여 줘요. 아이는 영문 가족관계증명서를 바로 꺼낼 수 있게 들고 있어요. 입국심사 뒤 수하물을 찾아요.",
          "timing": "상품 안내",
          "duration": "약 40분 · 혼잡 시 1시간",
          "coordinates": [
            16.0426,
            108.1972
          ],
          "approximate": true,
          "transit": {
            "mode": "flight",
            "label": "트리니티항공 TW011",
            "icon": "✈️",
            "waypoints": [
              [
                33.2,
                124.9
              ],
              [
                26.5,
                119.8
              ],
              [
                20.0,
                112.5
              ]
            ]
          },
          "links": [
            {
              "label": "베트남 출입국관리국 · 온라인 사전 입국신고",
              "url": "https://prearrival.immigration.gov.vn/",
              "note": "입국 3일 전부터 작성 · 가족 1인 1QR"
            },
            {
              "label": "다낭국제공항 공식 사이트",
              "url": "https://danangairport.vn/"
            }
          ]
        },
        {
          "id": "d1-sim",
          "time": "23:00",
          "title": "eSIM 개통 확인·소액 환전",
          "type": "airport",
          "details": "미리 산 eSIM을 켜고 데이터가 되는지 확인해요. Grab 요금과 첫날 물값 정도만 공항에서 동으로 바꾸고, 나머지는 시내에서 바꿔요.",
          "timing": "가족 계획",
          "duration": "15분"
        },
        {
          "id": "d1-grab",
          "time": "23:15",
          "title": "Grab으로 미케 비치 숙소 이동",
          "type": "transport",
          "details": "앱에서 승차 위치를 공항 도착층 Grab 픽업 구역으로 지정해요. 짐이 많으면 7인승(GrabCar 7)을 골라요. 미케 비치까지는 차로 15–20분이에요.",
          "timing": "가족 계획",
          "duration": "약 20분",
          "transportIcon": "🚕",
          "transit": {
            "mode": "taxi",
            "label": "Grab 차량",
            "icon": "🚕"
          },
          "links": [
            {
              "label": "Grab 베트남 · 차량 호출 안내",
              "url": "https://www.grab.com/vn/en/transport/"
            }
          ]
        },
        {
          "id": "d1-hotel",
          "time": "23:40",
          "title": "미케 비치 숙소 체크인",
          "type": "hotel",
          "details": "미케 비치 리조트·호텔이 모인 지역의 숙소를 기준으로 했어요. 체크인 때 여권을 맡기거나 보증금을 요구하는 곳이 있어요. 다음 날 아침이 이르니 바로 씻고 자요.",
          "timing": "가족 계획",
          "duration": "20분",
          "coordinates": [
            16.06,
            108.2468
          ],
          "approximate": true,
          "transit": {
            "mode": "taxi",
            "label": "Grab 차량",
            "icon": "🚕"
          }
        }
      ]
    },
    {
      "number": 2,
      "date": "2027-03-04",
      "city": "DA NANG",
      "theme": "바나힐 케이블카와 골든 브릿지, 오후엔 미케 비치",
      "note": "전날 자정 무렵 잠들었으니 아침은 07:00 기상으로 잡았어요. 바나힐은 08:00 개장 직후가 덜 붐비고 구름도 적은 편이라 07:45에는 출발해요. 산 정상은 시내보다 서늘하고 오후에 구름이 끼기 쉬워 골든 브릿지를 먼저 봐요. 하산 케이블카 줄을 생각해 13:30에는 내려오기 시작하고, 아이가 지치면 판타지 파크를 줄여요. 오후는 숙소에서 쉬었다가 해변으로 나가요.",
      "stops": [
        {
          "id": "d2-breakfast",
          "time": "07:00",
          "title": "숙소 조식·겉옷 챙기기",
          "type": "meal",
          "details": "바나힐 정상은 서늘하니 얇은 바람막이를 하나씩 챙겨요. 공원 안으로 음식을 가져갈 수 없어 간식은 차에 두거나 아침을 든든히 먹어요.",
          "timing": "가족 계획",
          "duration": "40분"
        },
        {
          "id": "d2-to-bana",
          "time": "07:45",
          "title": "Grab으로 바나힐 이동",
          "type": "transport",
          "details": "미케 비치에서 산 아래 케이블카 역까지 차로 약 45–60분이에요. 돌아올 때도 Grab을 부르면 되지만, 하루 기사 포함 차량을 빌리면 기다리는 시간을 줄일 수 있어요. Sun World 무료 셔틀은 지정 정류장에서 타며 사전 예약이 필요해요.",
          "timing": "가족 계획",
          "duration": "약 50분",
          "transportIcon": "🚕",
          "transit": {
            "mode": "taxi",
            "label": "Grab 또는 기사 포함 차량",
            "icon": "🚕"
          },
          "links": [
            {
              "label": "Grab 베트남 · 차량 호출 안내",
              "url": "https://www.grab.com/vn/en/transport/"
            },
            {
              "label": "Sun World 공식 예매 · 바나힐 케이블카 티켓",
              "url": "https://booking.sunworld.vn/en/ticket-detail/1484844",
              "note": "키 140cm 기준 성인·어린이 요금 구분"
            }
          ]
        },
        {
          "id": "d2-cablecar",
          "time": "08:40",
          "title": "바나힐 입장·케이블카 탑승",
          "type": "sight",